{
  "certificate_version": "0.3",
  "certificate_class": "EXACT-RATIONAL (same class as B1/B2/B7); perturbative-amplitude identities",
  "benchmark": "B15-ZERO",
  "problem": "B15-ZERO: exact ground-truth Tr(phi^3) amplitude dataset \u2014 two routes, hidden zeros, 2-splits, delta-shift to NLSM vs independent Feynman rules (R37)",
  "timestamp_utc": "2026-09-23T21:33:48Z",
  "headline": "Route A == Route B on 200 pts/n; all n(n-3)/2 zero loci vanish exactly; splits factorize exactly (eq. 1.7); lim delta^(n-2) A^delta == NLSM Feynman at 4/6/8 pts; dataset hash-stable",
  "arithmetic": "exact rational (Fraction) on every certified path; no floats",
  "hard_constraints_certified": true,
  "score": "finite",
  "m_layer_stipulations": [
    "Theory-internal perturbative identities (tree level, planar); no measurement interface",
    "Kinematic conventions transcribed from arXiv:2312.16282 eqs. 2.2-2.4",
    "NLSM Feynman route fixed to mostly-plus signature so that A_4 = -(X13+X24) (2401.05483 \u00a7I); the 6- and 8-point equalities carry no further freedom",
    "Hidden zeros are unobservable loci: E0 mathematical warrant, no measurement warrant"
  ],
  "calibration_route": "none required (exact identities; seeded rational points registered)",
  "inputs": {
    "dataset_path": "data/b15/zero_dataset_v1.json",
    "dataset_sha256": "6c6aca37149d05e1d6c929b33e14b59337442caf0b1fe30f23b388d8d9c2fa1c",
    "seed": 20260923,
    "points_per_n_T2": 200,
    "split_points": 50,
    "nonzero_rate_threshold": "19/20"
  },
  "results": {
    "T1_catalan": {
      "status": "PASS",
      "counts": {
        "4": 2,
        "5": 5,
        "6": 14,
        "7": 42,
        "8": 132
      }
    },
    "T2_routeA_eq_routeB": {
      "status": "PASS",
      "points_per_n": {
        "5": 200,
        "6": 200,
        "8": 200
      },
      "falsifier": "F2 not triggered"
    },
    "T3_zeros": {
      "status": "PASS",
      "per_n": {
        "5": {
          "loci": 5,
          "example_locus": {
            "Z5-i3-k0": [
              "c1,3",
              "c1,4"
            ],
            "Z5-i3-k1": [
              "c2,4",
              "c2,5"
            ]
          }
        },
        "6": {
          "loci": 9,
          "example_locus": {
            "Z6-i3-k0": [
              "c1,3",
              "c1,4",
              "c1,5"
            ],
            "Z6-i3-k1": [
              "c2,4",
              "c2,5",
              "c2,6"
            ]
          }
        },
        "8": {
          "loci": 20,
          "example_locus": {
            "Z8-i3-k0": [
              "c1,3",
              "c1,4",
              "c1,5",
              "c1,6",
              "c1,7"
            ],
            "Z8-i3-k1": [
              "c2,4",
              "c2,5",
              "c2,6",
              "c2,7",
              "c2,8"
            ]
          }
        }
      },
      "falsifier": "F3 not triggered"
    },
    "T4_negative_control": {
      "status": "PASS",
      "per_n": {
        "5": {
          "constraints": 2,
          "nonzero_rate": "1/1"
        },
        "6": {
          "constraints": 4,
          "nonzero_rate": "1/1"
        },
        "8": {
          "constraints": 9,
          "nonzero_rate": "1/1"
        }
      },
      "threshold": "19/20"
    },
    "T5_splits": {
      "status": "PASS",
      "splits": {
        "S5-a": {
          "triangle": [
            3,
            5,
            1
          ],
          "factors": [
            4,
            4
          ],
          "vanishing_c": [
            "c1,3"
          ],
          "points": 50
        },
        "S5-b": {
          "triangle": [
            1,
            3,
            4
          ],
          "factors": [
            4,
            4
          ],
          "vanishing_c": [
            "c1,4"
          ],
          "points": 50
        },
        "S6-a": {
          "triangle": [
            5,
            1,
            3
          ],
          "factors": [
            5,
            4
          ],
          "vanishing_c": [
            "c1,3",
            "c3,5"
          ],
          "points": 50
        },
        "S6-b": {
          "triangle": [
            1,
            3,
            5
          ],
          "factors": [
            5,
            4
          ],
          "vanishing_c": [
            "c1,5",
            "c3,5"
          ],
          "points": 50
        },
        "S6-c": {
          "triangle": [
            2,
            4,
            6
          ],
          "factors": [
            5,
            4
          ],
          "vanishing_c": [
            "c2,6",
            "c4,6"
          ],
          "points": 50
        },
        "S8-a": {
          "triangle": [
            1,
            3,
            5
          ],
          "factors": [
            5,
            6
          ],
          "vanishing_c": [
            "c1,5",
            "c1,6",
            "c1,7",
            "c3,5",
            "c3,6",
            "c3,7"
          ],
          "points": 50
        },
        "S8-b": {
          "triangle": [
            1,
            4,
            7
          ],
          "factors": [
            7,
            4
          ],
          "vanishing_c": [
            "c1,7",
            "c2,7",
            "c4,7",
            "c5,7"
          ],
          "points": 50
        },
        "S8-c": {
          "triangle": [
            2,
            5,
            7
          ],
          "factors": [
            6,
            5
          ],
          "vanishing_c": [
            "c2,7",
            "c2,8",
            "c3,7",
            "c3,8",
            "c5,7",
            "c5,8"
          ],
          "points": 50
        }
      },
      "near_zero_eq_3_3": {
        "points": 50
      }
    },
    "T6_delta_shift_nlsm": {
      "status": "PASS",
      "points_per_n": {
        "4": 50,
        "6": 50,
        "8": 20
      },
      "prescription": "lim delta^(n-2) A^delta_n, X_ee+delta, X_oo-delta (2401.05483 eq. 2)"
    },
    "T7_dataset": {
      "status": "PASS",
      "records": 3664,
      "dataset_sha256": "6c6aca37149d05e1d6c929b33e14b59337442caf0b1fe30f23b388d8d9c2fa1c",
      "generator_sha256": "a49129f3a8c30ce945bdcc02f31f8006e8b8c85e2bb0e50aad3c4910da175995",
      "seed": 20260923
    }
  },
  "soundness": "SOUND",
  "warnings": [],
  "ground_truth_route": "planar-feynman-sum",
  "verdict": "PERMITTED",
  "verdict_cause": null,
  "verdict_class": null,
  "verdict_display": "PERMITTED",
  "witness": {
    "routes": [
      "planar-feynman-sum (Route A)",
      "factorization-recursion (Route B)"
    ],
    "loci_per_n": {
      "5": 5,
      "6": 9,
      "8": 20
    },
    "split_factorizations": {
      "S5-a": [
        "c1,3"
      ],
      "S5-b": [
        "c1,4"
      ],
      "S6-a": [
        "c1,3",
        "c3,5"
      ],
      "S6-b": [
        "c1,5",
        "c3,5"
      ],
      "S6-c": [
        "c2,6",
        "c4,6"
      ],
      "S8-a": [
        "c1,5",
        "c1,6",
        "c1,7",
        "c3,5",
        "c3,6",
        "c3,7"
      ],
      "S8-b": [
        "c1,7",
        "c2,7",
        "c4,7",
        "c5,7"
      ],
      "S8-c": [
        "c2,7",
        "c2,8",
        "c3,7",
        "c3,8",
        "c5,7",
        "c5,8"
      ]
    }
  },
  "impossibility_certificate": null,
  "similarity": null,
  "confidence": null,
  "correlator": null,
  "evidence_level": "E0",
  "pir_level": "L2",
  "layer": "DOMAIN",
  "assumptions": [],
  "prereg_ref": "prereg-002@ed177ebf62cc6453c887d2829200dfb9c2e21b45",
  "prereg_sha256": "9bf477eec119e2ce10932e644d41bbb733bbdf1fce30e30a2246cdeafe617427",
  "falsifier_direction": "F2: Route A != Route B anywhere -> generator REJECTED, no dataset; F3: a registered zero not vanishing exactly -> erratum/open item, never a patch",
  "seed": 20260923,
  "ci_seed_env": "",
  "python_version": "3.11.15",
  "generator_sha256": "a49129f3a8c30ce945bdcc02f31f8006e8b8c85e2bb0e50aad3c4910da175995",
  "pir_facts": [
    {
      "fact_id": "fct_sha256_4c003847ff0e723b",
      "pir_level": "L2",
      "evidence_level": "E0",
      "layer": "DOMAIN",
      "namespace": "domain",
      "status": "SUPPORTED",
      "verdict": "PERMITTED",
      "analyzer": {
        "id": "b15_surf.zero",
        "version": "0.1.0",
        "tag": "SOUND"
      },
      "warnings": [],
      "depends_on_facts": [],
      "assumptions": [],
      "source_spans": [
        {
          "artifact_id": "certificates/b15-zero_certificate.json",
          "span": "results"
        }
      ],
      "measurement_interface": [
        "none (theory-internal identities; exact rational evaluation)"
      ],
      "content": {
        "subject": "Tr(phi^3) tree amplitudes n<=8: hidden zeros, 2-splits, delta-shift->NLSM",
        "dataset_sha256": "6c6aca37149d05e1d6c929b33e14b59337442caf0b1fe30f23b388d8d9c2fa1c"
      },
      "witness": {
        "routes": [
          "planar-feynman-sum (Route A)",
          "factorization-recursion (Route B)"
        ],
        "loci_per_n": {
          "5": 5,
          "6": 9,
          "8": 20
        },
        "split_factorizations": {
          "S5-a": [
            "c1,3"
          ],
          "S5-b": [
            "c1,4"
          ],
          "S6-a": [
            "c1,3",
            "c3,5"
          ],
          "S6-b": [
            "c1,5",
            "c3,5"
          ],
          "S6-c": [
            "c2,6",
            "c4,6"
          ],
          "S8-a": [
            "c1,5",
            "c1,6",
            "c1,7",
            "c3,5",
            "c3,6",
            "c3,7"
          ],
          "S8-b": [
            "c1,7",
            "c2,7",
            "c4,7",
            "c5,7"
          ],
          "S8-c": [
            "c2,7",
            "c2,8",
            "c3,7",
            "c3,8",
            "c5,7",
            "c5,8"
          ]
        }
      },
      "impossibility_certificate": null,